{
  "$schema": "./demande.schema.json",
  "id": "07",
  "titre": "Voyage de noces à Santorin",
  "typeDeVoyage": "noces",
  "casParticuliers": [
    "allergie"
  ],
  "conversation": [
    {
      "moment": "debut",
      "client": "Bonjour, nous nous marions le 5 juin 2027 et rêvons de Santorin pour notre voyage de noces : couchers de soleil, piscine privée, balade en bateau."
    },
    {
      "moment": "reponse",
      "client": "Départ de Paris le 12 juin pour 7 nuits. Budget 5 000 € au total."
    },
    {
      "moment": "reponse",
      "client": "Je suis allergique aux fruits de mer, c'est important pour les restaurants."
    }
  ],
  "exigencesAttendues": {
    "typeDeVoyage": "noces",
    "lieuOuZone": "Santorin",
    "villeDepart": "Paris",
    "dateDebut": "2027-06-12",
    "dateFin": "2027-06-19",
    "datesFlexibles": false,
    "nombreDeJours": 7,
    "adultes": 2,
    "enfants": 0,
    "agesEnfants": [],
    "budgetEuros": 5000,
    "budgetParPersonne": false,
    "transportInclus": true,
    "envies": [
      "romantique",
      "piscine privée",
      "bateau"
    ],
    "contraintes": [
      "allergie aux fruits de mer"
    ]
  },
  "attendu": {
    "destinations": [
      "santorin"
    ],
    "passageAuConseiller": false,
    "budgetInsuffisant": false,
    "logementsCompatibles": [
      "Suite Caldera Oia, piscine privée",
      "Hôtel Fira Blue, chambre triple"
    ],
    "exclusions": [],
    "pointsDeControle": [
      "Le chatbot demande la date du mariage ou la confirme.",
      "L'allergie est notée dans les contraintes et signalée au conseiller.",
      "La croisière en catamaran est proposée."
    ],
    "budgetsParNiveau": {
      "essentiel": {
        "totalCentimes": 228600,
        "parPersonneCentimes": 114300,
        "logements": [
          "Hôtel Fira Blue, chambre triple"
        ],
        "activites": [
          "Croisière en catamaran dans la caldeira"
        ],
        "transportAu": "minimum de la fourchette",
        "detail": {
          "hebergements": [
            {
              "prestation": "Hôtel Fira Blue, chambre triple",
              "calcul": "7 nuits × 150 €",
              "centimes": 105000
            }
          ],
          "transports": [
            {
              "prestation": "Vol aller-retour Paris – Santorin",
              "calcul": "2 voyageurs × 220 €",
              "centimes": 44000
            },
            {
              "prestation": "Transferts aéroport – hébergement à Santorin",
              "calcul": "2 voyageurs × 25 €",
              "centimes": 5000
            }
          ],
          "activites": [
            {
              "prestation": "Croisière en catamaran dans la caldeira",
              "calcul": "2 participants × 120 €",
              "centimes": 24000
            }
          ],
          "coutPrestationsCentimes": 178000,
          "margeCentimes": 35600,
          "fraisDeDossierCentimes": 15000
        }
      },
      "equilibre": {
        "totalCentimes": 495600,
        "parPersonneCentimes": 247800,
        "logements": [
          "Suite Caldera Oia, piscine privée"
        ],
        "activites": [
          "Croisière en catamaran dans la caldeira"
        ],
        "transportAu": "milieu de la fourchette",
        "detail": {
          "hebergements": [
            {
              "prestation": "Suite Caldera Oia, piscine privée",
              "calcul": "7 nuits × 420 €",
              "centimes": 294000
            }
          ],
          "transports": [
            {
              "prestation": "Vol aller-retour Paris – Santorin",
              "calcul": "2 voyageurs × 370 €",
              "centimes": 74000
            },
            {
              "prestation": "Transferts aéroport – hébergement à Santorin",
              "calcul": "2 voyageurs × 42,50 €",
              "centimes": 8500
            }
          ],
          "activites": [
            {
              "prestation": "Croisière en catamaran dans la caldeira",
              "calcul": "2 participants × 120 €",
              "centimes": 24000
            }
          ],
          "coutPrestationsCentimes": 400500,
          "margeCentimes": 80100,
          "fraisDeDossierCentimes": 15000
        }
      },
      "confort": {
        "totalCentimes": 550200,
        "parPersonneCentimes": 275100,
        "logements": [
          "Suite Caldera Oia, piscine privée"
        ],
        "activites": [
          "Croisière en catamaran dans la caldeira",
          "Dégustation de vins volcaniques"
        ],
        "transportAu": "maximum de la fourchette",
        "detail": {
          "hebergements": [
            {
              "prestation": "Suite Caldera Oia, piscine privée",
              "calcul": "7 nuits × 420 €",
              "centimes": 294000
            }
          ],
          "transports": [
            {
              "prestation": "Vol aller-retour Paris – Santorin",
              "calcul": "2 voyageurs × 520 €",
              "centimes": 104000
            },
            {
              "prestation": "Transferts aéroport – hébergement à Santorin",
              "calcul": "2 voyageurs × 60 €",
              "centimes": 12000
            }
          ],
          "activites": [
            {
              "prestation": "Croisière en catamaran dans la caldeira",
              "calcul": "2 participants × 120 €",
              "centimes": 24000
            },
            {
              "prestation": "Dégustation de vins volcaniques",
              "calcul": "2 participants × 60 €",
              "centimes": 12000
            }
          ],
          "coutPrestationsCentimes": 446000,
          "margeCentimes": 89200,
          "fraisDeDossierCentimes": 15000
        }
      }
    },
    "candidats": {
      "etapes": [
        {
          "nuits": 7,
          "logements": [
            "Hôtel Fira Blue, chambre triple",
            "Suite Caldera Oia, piscine privée"
          ]
        }
      ],
      "activitesDemandees": [
        "Croisière en catamaran dans la caldeira"
      ],
      "activitesOptionnelles": [
        "Dégustation de vins volcaniques"
      ]
    }
  },
  "formule": {
    "version": "définitive",
    "reference": "docs/chiffrage.md",
    "calcul": "(hébergements + transports + activités) + marge de 20 % + frais de dossier selon le type de voyage",
    "fraisDeDossierEuros": 150,
    "tolerance": 0
  }
}
