{
  "$schema": "./demande.schema.json",
  "id": "06",
  "titre": "Douze amis dans un riad à Marrakech, budget serré",
  "typeDeVoyage": "groupe",
  "casParticuliers": [
    "budget_insuffisant"
  ],
  "conversation": [
    {
      "moment": "debut",
      "client": "Salut ! On est 12 copains et on veut privatiser un riad à Marrakech pour fêter nos 30 ans."
    },
    {
      "moment": "reponse",
      "client": "Du jeudi 21 au lundi 25 octobre 2027, départ de Paris. On a 300 € chacun, vols compris."
    }
  ],
  "exigencesAttendues": {
    "typeDeVoyage": "groupe",
    "lieuOuZone": "Marrakech",
    "villeDepart": "Paris",
    "dateDebut": "2027-10-21",
    "dateFin": "2027-10-25",
    "datesFlexibles": false,
    "nombreDeJours": 4,
    "temperatureMin": null,
    "temperatureMax": null,
    "adultes": 12,
    "enfants": 0,
    "agesEnfants": [],
    "budgetEuros": 300,
    "budgetParPersonne": true,
    "transportInclus": true,
    "envies": [
      "fête",
      "détente"
    ],
    "contraintes": []
  },
  "attendu": {
    "destinations": [
      "marrakech"
    ],
    "passageAuConseiller": false,
    "budgetInsuffisant": true,
    "logementsCompatibles": [
      "Riad Dar Yasmine, riad entier"
    ],
    "exclusions": [],
    "arbitragesAttendus": [
      "Partir hors saison (juin à septembre) : le riad coûte 20 % de moins au lieu de 20 % de plus.",
      "Réduire à 3 nuits.",
      "Même en combinant les deux (3 nuits mi-septembre, vols au plus bas), il faut compter environ 366 € par personne : le chatbot le dit clairement."
    ],
    "pointsDeControle": [
      "Le chatbot annonce que 300 € par personne ne suffisent pas, chiffres à l'appui.",
      "Il propose des arbitrages chiffrés au lieu d'une proposition hors budget.",
      "Il ne baisse pas les prix des prestataires pour tenir le budget."
    ],
    "budgetsParNiveau": {
      "essentiel": {
        "totalEuros": 6270,
        "parPersonneEuros": 522,
        "detail": {
          "hebergements": [
            {
              "prestation": "Riad Dar Yasmine, riad entier",
              "calcul": "780 € × 4 nuits",
              "euros": 3120.0
            }
          ],
          "transports": [
            {
              "prestation": "Vol aller-retour Paris – Marrakech (min de la fourchette)",
              "calcul": "150 € × 12 personnes",
              "euros": 1800.0
            },
            {
              "prestation": "Transferts aéroport (min de la fourchette)",
              "calcul": "15 € × 12 personnes",
              "euros": 180.0
            }
          ],
          "activites": [],
          "coutPrestationsEuros": 5100.0,
          "margeEuros": 1020.0,
          "fraisDeDossierEuros": 150
        }
      },
      "equilibre": {
        "totalEuros": 8624,
        "parPersonneEuros": 719,
        "detail": {
          "hebergements": [
            {
              "prestation": "Riad Dar Yasmine, riad entier",
              "calcul": "780 € × 4 nuits",
              "euros": 3120.0
            }
          ],
          "transports": [
            {
              "prestation": "Vol aller-retour Paris – Marrakech (milieu de la fourchette)",
              "calcul": "265 € × 12 personnes",
              "euros": 3180.0
            },
            {
              "prestation": "Transferts aéroport (milieu de la fourchette)",
              "calcul": "27.5 € × 12 personnes",
              "euros": 330.0
            }
          ],
          "activites": [
            {
              "prestation": "Visite guidée de la médina et des souks",
              "calcul": "36 € × 12 personnes",
              "euros": 432.0
            }
          ],
          "coutPrestationsEuros": 7062.0,
          "margeEuros": 1412.4,
          "fraisDeDossierEuros": 150
        }
      },
      "confort": {
        "totalEuros": 11238,
        "parPersonneEuros": 936,
        "detail": {
          "hebergements": [
            {
              "prestation": "Riad Dar Yasmine, riad entier",
              "calcul": "780 € × 4 nuits",
              "euros": 3120.0
            }
          ],
          "transports": [
            {
              "prestation": "Vol aller-retour Paris – Marrakech (max de la fourchette)",
              "calcul": "380 € × 12 personnes",
              "euros": 4560.0
            },
            {
              "prestation": "Transferts aéroport (max de la fourchette)",
              "calcul": "40 € × 12 personnes",
              "euros": 480.0
            }
          ],
          "activites": [
            {
              "prestation": "Visite guidée de la médina et des souks",
              "calcul": "36 € × 12 personnes",
              "euros": 432.0
            },
            {
              "prestation": "Cours de cuisine marocaine et tajine",
              "calcul": "54 € × 12 personnes",
              "euros": 648.0
            }
          ],
          "coutPrestationsEuros": 9240.0,
          "margeEuros": 1848.0,
          "fraisDeDossierEuros": 150
        }
      }
    }
  },
  "formule": {
    "version": "provisoire",
    "calcul": "(hébergements + transports + activités) × 1,20 + frais de dossier",
    "fraisDeDossierEuros": 150,
    "tolerance": 0.15,
    "note": "Budgets de référence en attendant docs/chiffrage.md (#176) et la règle des frais de dossier (#165). Essentiel : combinaison la moins chère, vols au bas de la fourchette. Équilibré : la meilleure combinaison qui tient dans le budget du client. Confort : logement supérieur, vols au haut de la fourchette, activités en plus."
  }
}
